id,info,description,fp_cost,hp_cost,hp,image_url
2774,Summons three little living jar spirits,"Ashen remains in which spirits yet dwell.
Use to summon the spirits of three little living jars.
Summoning consumes HP rather than FP.

These reckless spirits sacrifice themselves to vanquish their summoner's foes, and explode upon death.
Though their bravery is admirable, their explosions can harm friend as well as foe, and they will also immediately explode on contact with fire.

""Tell the others—tell them how brightly a fire jar burns.""",,135.0,507,https://eldenring.fanapis.com/images/spirits/17f69ddaf0fl0i2rjyrykqzpcxfre.png
2775,Summons spirit jellyfish,"Ashen remains in which spirits yet dwell.
Use to summon a spirit jellyfish.

A floating spirit that illuminates its surroundings. 
Prone to tears, the jellyfish girl searches for her distant home. Will bravely spew poison at foes on her summoner's behalf.

It seems her name is Aurelia.",31.0,,909,https://eldenring.fanapis.com/images/spirits/17f697066c0l0i2rfjc7ykblsby5ox.png
2776,Summons spirit of Stormhawk Deenh,"Ashen remains in which spirits yet dwell.
Use to summon the spirit of Deenh the Stormhawk.

Spirit of a fierce hawk that faithfully rendered lifelong service to the old king of Stormveil long ago, when the true storm raged. Its cries embolden its fellows in battle, and the tempestuous winds that encircle it shred through foes.",47.0,,711,https://eldenring.fanapis.com/images/spirits/17f69ecd388l0i2rfmox0cljjuuri.png
2777,Summons Twinsage sorcerer spirit,"Ashen remains in which spirits yet dwell.
Use to summon the spirit of a Twinsage sorcerer.

Spirit of a Raya Lucaria sorcerer wearing a stone crown.
Those who study the Twinsage Conspectus are the academy's elite, capable of mastering the Glintstone Cometshard and Crystal Burst sorceries.",89.0,,852,https://eldenring.fanapis.com/images/spirits/17f69bf3136l0i2rfs0407qepaxpho.png
2778,Summons three vulgar militia spirits,"Ashen remains in which spirits yet dwell.
Use to summon the spirits of three vulgar militiamen.

Spirits of the vulgar militia who wield long-hafted, serrated hatchets. These brutal weapons are particularly effective at causing blood loss to opponents.
In the Lands Between, the small were scorned, and so they formed their vulgar militia as a means to make a living, albeit in ignominy.",70.0,,518,https://eldenring.fanapis.com/images/spirits/17f6987842cl0i2rh0v17nw2hyrdslh.png
2779,Summons five wandering noble spirits,"Ashen remains in which spirits yet dwell.
Use to summon the spirits of five wandering nobles.

The spirits of nobles who, after death, now wander the Lands Between. Surely they were in search of something once—but whatever it was has long been forgotten.",28.0,,429,https://eldenring.fanapis.com/images/spirits/17f69871c91l0i2rfwnjft8senytx.png
2780,Summons warhawk spirit,"Ashen remains in which spirits yet dwell.
Use to summon the spirit of a warhawk.

Spirit of a Stormveil warhawk, the talons of which have been sliced off so that razor-fine swords could be grafted in their place.
With its lord vanquished, and its wings wounded, the hawk perished as it solemnly gazed at its former home.
The storm is a warhawk's cradle.",52.0,,993,https://eldenring.fanapis.com/images/spirits/17f69e64c4al0i2rg6ksmiwxmcgad.png
2781,Summons winged misbegotten spirit,"Ashen remains in which spirits yet dwell.
Use to summon the spirit of a winged misbegotten.

A spirit with the aspect of wings which takes flight to loose arrows from its bow. The misbegotten are held to be a punishment for making contact with the Crucible, and from birth they are treated as slaves, or worse.",37.0,,646,https://eldenring.fanapis.com/images/spirits/17f69ba4ffal0i2rgd5rdlvueh3v0q.png
